{
  "$schema": "http://json-schema.org/draft-04/schema#",
  "additionalProperties": false,
  "definitions": {
    "iso8601": {
      "type": "string",
      "description": "e.g. 2014-06-29",
      "pattern": "^([1-2][0-9]{3}-[0-1][0-9]-[0-3][0-9]|[1-2][0-9]{3}-[0-1][0-9]|[1-2][0-9]{3})$"
    }
  },
  "properties": {
    "$schema": {
      "type": "string",
      "description": "link to the version of the schema that can validate the blog",
      "format": "uri"
    },
    "site": {
      "type": "object",
      "additionalProperties": true,
      "properties": {
        "title": {
          "type": "string"
        },
        "description": {
          "type": "string",
          "description": "Welcome to my webpage"
        }
      }
    },
    "basics": {
      "type": "object",
      "additionalProperties": true,
      "properties": {
        "name": {
          "type": "string"
        },
        "label": {
          "type": "string",
          "description": "e.g. Web Developer"
        },
        "image": {
          "type": "string",
          "description": "URL (as per RFC 3986) to a image in JPEG or PNG format"
        },
        "email": {
          "type": "string",
          "description": "e.g. thomas@gmail.com",
          "format": "email"
        },
        "phone": {
          "type": "string",
          "description": "Phone numbers are stored as strings so use any format you like, e.g. 712-117-2923"
        },
        "url": {
          "type": "string",
          "description": "URL (as per RFC 3986) to your website, e.g. personal homepage",
          "format": "uri"
        },
        "summary": {
          "type": "string",
          "description": "Write a short 2-3 sentence biography about yourself"
        },
        "location": {
          "type": "object",
          "additionalProperties": true,
          "properties": {
            "address": {
              "type": "string",
              "description": "To add multiple address lines, use \n. For example, 1234 Glücklichkeit Straße\nHinterhaus 5. Etage li."
            },
            "postalCode": {
              "type": "string"
            },
            "city": {
              "type": "string"
            },
            "countryCode": {
              "type": "string",
              "description": "code as per ISO-3166-1 ALPHA-2, e.g. US, AU, IN"
            },
            "region": {
              "type": "string",
              "description": "The general region where you live. Can be a US state, or a province, for instance."
            }
          }
        },
        "profiles": {
          "type": "array",
          "description": "Specify any number of social networks that you participate in",
          "additionalItems": false,
          "items": {
            "type": "object",
            "additionalProperties": true,
            "properties": {
              "network": {
                "type": "string",
                "description": "e.g. Facebook or Twitter"
              },
              "username": {
                "type": "string",
                "description": "e.g. neutralthoughts"
              },
              "url": {
                "type": "string",
                "description": "e.g. http://twitter.example.com/neutralthoughts",
                "format": "uri"
              }
            }
          }
        }
      }
    },
    "posts": {
      "type": "array",
      "additionalItems": false,
      "items": {
        "type": "object",
        "additionalProperties": true,
        "properties": {
          "title": {
            "type": "string",
            "description": "Welcome to my blog"
          },
          "description": {
            "type": "string",
            "description": "Welcome to my post"
          },
          "source": {
            "type": "string",
            "description": "./first-blog.md"
          },
          "createdAt": {
            "$ref": "#/definitions/iso8601"
          },
          "updatedAt": {
            "$ref": "#/definitions/iso8601"
          }
        }
      }
    },
    "pages": {
      "type": "array",
      "additionalItems": false,
      "items": {
        "type": "object",
        "additionalProperties": true,
        "properties": {
          "title": {
            "type": "string",
            "description": "About page"
          },
          "description": {
            "type": "string",
            "description": "Welcome to my webpage"
          },
          "source": {
            "type": "string",
            "description": "./about-me.md"
          },
          "createdAt": {
            "$ref": "#/definitions/iso8601"
          },
          "updatedAt": {
            "$ref": "#/definitions/iso8601"
          }
        }
      }
    },
    "meta": {
      "type": "object",
      "description": "The schema version and any other tooling configuration lives here",
      "additionalProperties": true,
      "properties": {
        "canonical": {
          "type": "string",
          "description": "URL (as per RFC 3986) to latest version of this document",
          "format": "uri"
        },
        "version": {
          "type": "string",
          "description": "A version field which follows semver - e.g. v1.0.0"
        },
        "lastModified": {
          "type": "string",
          "description": "Using ISO 8601 with YYYY-MM-DDThh:mm:ss"
        }
      }
    }
  },
  "title": "Blog Schema",
  "type": "object"
}
